{
  "report_id": "fixture-feature-tier-d-decorator-class",
  "subject": "fixture.typescript_importer.d_decorator_class",
  "source_language": "typescript",
  "summary": {
    "A": 0,
    "B": 0,
    "C": 0,
    "D": 1
  },
  "items": [
    {
      "feature": "decorator-bearing class",
      "tier": "D",
      "rationale": "Decorator-bearing classes are outside the bounded Phase 7 TypeScript interface-only slice; this file is reserved placeholder evidence only and does not record a live importer rejection.",
      "fallback": "reject"
    }
  ]
}
